{
  "id": "grid-2x2",
  "name": "Grid 2x2",
  "icon": "⬜⬜",
  "category": "grid",
  "slots": [
    {
      "x": 0,
      "y": 0,
      "width": 50,
      "height": 50,
      "type": "image"
    },
    {
      "x": 50,
      "y": 0,
      "width": 50,
      "height": 50,
      "type": "image"
    },
    {
      "x": 0,
      "y": 50,
      "width": 50,
      "height": 50,
      "type": "image"
    },
    {
      "x": 50,
      "y": 50,
      "width": 50,
      "height": 50,
      "type": "image"
    }
  ]
}
