{
  "id": "grid-3x3",
  "name": "Grid 3x3",
  "icon": "⬜⬜⬜",
  "category": "grid",
  "slots": [
    { "x": 0, "y": 0, "width": 33.33, "height": 33.33, "type": "image" },
    { "x": 33.33, "y": 0, "width": 33.33, "height": 33.33, "type": "image" },
    { "x": 66.66, "y": 0, "width": 33.34, "height": 33.33, "type": "image" },
    { "x": 0, "y": 33.33, "width": 33.33, "height": 33.33, "type": "image" },
    { "x": 33.33, "y": 33.33, "width": 33.33, "height": 33.33, "type": "image" },
    { "x": 66.66, "y": 33.33, "width": 33.34, "height": 33.33, "type": "image" },
    { "x": 0, "y": 66.66, "width": 33.33, "height": 33.34, "type": "image" },
    { "x": 33.33, "y": 66.66, "width": 33.33, "height": 33.34, "type": "image" },
    { "x": 66.66, "y": 66.66, "width": 33.34, "height": 33.34, "type": "image" }
  ]
}
