{
  "id": "two-vertical",
  "name": "Two Vertical",
  "icon": "⬜―⬜",
  "category": "basic",
  "slots": [
    {
      "x": 0,
      "y": 0,
      "width": 100,
      "height": 50,
      "type": "image"
    },
    {
      "x": 0,
      "y": 50,
      "width": 100,
      "height": 50,
      "type": "image"
    }
  ]
}
